{"k":"ASELS","market":"BIST","cur":"TRY","t":["2024-09-12","2024-09-13","2024-09-16","2024-09-17","2024-09-18","2024-09-19","2024-09-20","2024-09-23","2024-09-24","2024-09-25","2024-09-26","2024-09-27","2024-09-30","2024-10-01","2024-10-02","2024-10-03","2024-10-04","2024-10-07","2024-10-08","2024-10-09","2024-10-10","2024-10-11","2024-10-14","2024-10-15","2024-10-16","2024-10-17","2024-10-18","2024-10-21","2024-10-22","2024-10-23","2024-10-24","2024-10-25","2024-10-28","2024-10-30","2024-10-31","2024-11-01","2024-11-04","2024-11-05","2024-11-06","2024-11-07","2024-11-08","2024-11-11","2024-11-12","2024-11-13","2024-11-14","2024-11-15","2024-11-18","2024-11-19","2024-11-20","2024-11-21","2024-11-22","2024-11-25","2024-11-26","2024-11-27","2024-11-28","2024-11-29","2024-12-02","2024-12-03","2024-12-04","2024-12-05","2024-12-06","2024-12-09","2024-12-10","2024-12-11","2024-12-12","2024-12-13","2024-12-16","2024-12-17","2024-12-18","2024-12-19","2024-12-20","2024-12-23","2024-12-24","2024-12-25","2024-12-26","2024-12-27","2024-12-30","2024-12-31","2025-01-02","2025-01-03","2025-01-06","2025-01-07","2025-01-08","2025-01-09","2025-01-10","2025-01-13","2025-01-14","2025-01-15","2025-01-16","2025-01-17","2025-01-20","2025-01-21","2025-01-22","2025-01-23","2025-01-24","2025-01-27","2025-01-28","2025-01-29","2025-01-30","2025-01-31","2025-02-03","2025-02-04","2025-02-05","2025-02-06","2025-02-07","2025-02-10","2025-02-11","2025-02-12","2025-02-13","2025-02-14","2025-02-17","2025-02-18","2025-02-19","2025-02-20","2025-02-21","2025-02-24","2025-02-25","2025-02-26","2025-02-27","2025-02-28","2025-03-03","2025-03-04","2025-03-05","2025-03-06","2025-03-07","2025-03-10","2025-03-11","2025-03-12","2025-03-13","2025-03-14","2025-03-17","2025-03-18","2025-03-19","2025-03-20","2025-03-21","2025-03-24","2025-03-25","2025-03-26","2025-03-27","2025-03-28","2025-04-02","2025-04-03","2025-04-04","2025-04-07","2025-04-08","2025-04-09","2025-04-10","2025-04-11","2025-04-14","2025-04-15","2025-04-16","2025-04-17","2025-04-18","2025-04-21","2025-04-22","2025-04-24","2025-04-25","2025-04-28","2025-04-29","2025-04-30","2025-05-02","2025-05-05","2025-05-06","2025-05-07","2025-05-08","2025-05-09","2025-05-12","2025-05-13","2025-05-14","2025-05-15","2025-05-16","2025-05-20","2025-05-21","2025-05-22","2025-05-23","2025-05-26","2025-05-27","2025-05-28","2025-05-29","2025-05-30","2025-06-02","2025-06-03","2025-06-04","2025-06-05","2025-06-10","2025-06-11","2025-06-12","2025-06-13","2025-06-16","2025-06-17","2025-06-18","2025-06-19","2025-06-20","2025-06-23","2025-06-24","2025-06-25","2025-06-26","2025-06-27","2025-06-30","2025-07-01","2025-07-02","2025-07-03","2025-07-04","2025-07-07","2025-07-08","2025-07-09","2025-07-10","2025-07-11","2025-07-14","2025-07-16","2025-07-17","2025-07-18","2025-07-21","2025-07-22","2025-07-23","2025-07-24","2025-07-25","2025-07-28","2025-07-29","2025-07-30","2025-07-31","2025-08-01","2025-08-04","2025-08-05","2025-08-06","2025-08-07","2025-08-08","2025-08-11","2025-08-12","2025-08-13","2025-08-14","2025-08-15","2025-08-18","2025-08-19","2025-08-20","2025-08-21","2025-08-22","2025-08-25","2025-08-26","2025-08-27","2025-08-28","2025-08-29","2025-09-01","2025-09-02","2025-09-03","2025-09-04","2025-09-05","2025-09-08","2025-09-09","2025-09-10","2025-09-11","2025-09-12","2025-09-15","2025-09-16","2025-09-17","2025-09-18","2025-09-19","2025-09-22","2025-09-23","2025-09-24","2025-09-25","2025-09-26","2025-09-29","2025-09-30","2025-10-01","2025-10-02","2025-10-03","2025-10-06","2025-10-07","2025-10-08","2025-10-09","2025-10-10","2025-10-13","2025-10-14","2025-10-15","2025-10-16","2025-10-17","2025-10-20","2025-10-21","2025-10-22","2025-10-23","2025-10-24","2025-10-27","2025-10-28","2025-10-30","2025-10-31","2025-11-03","2025-11-04","2025-11-05","2025-11-06","2025-11-07","2025-11-10","2025-11-11","2025-11-12","2025-11-13","2025-11-14","2025-11-17","2025-11-18","2025-11-19","2025-11-20","2025-11-21","2025-11-24","2025-11-25","2025-11-26","2025-11-27","2025-11-28","2025-12-01","2025-12-02","2025-12-03","2025-12-04","2025-12-05","2025-12-08","2025-12-09","2025-12-10","2025-12-11","2025-12-12","2025-12-15","2025-12-16","2025-12-17","2025-12-18","2025-12-19","2025-12-22","2025-12-23","2025-12-24","2025-12-25","2025-12-26","2025-12-29","2025-12-30","2025-12-31","2026-01-02","2026-01-05","2026-01-06","2026-01-07","2026-01-08","2026-01-09","2026-01-12","2026-01-13","2026-01-14","2026-01-15","2026-01-16","2026-01-19","2026-01-20","2026-01-21","2026-01-22","2026-01-23","2026-01-26","2026-01-27","2026-01-28","2026-01-29","2026-01-30","2026-02-02","2026-02-03","2026-02-04","2026-02-05","2026-02-06","2026-02-09","2026-02-10","2026-02-11","2026-02-12","2026-02-13","2026-02-16","2026-02-17","2026-02-18","2026-02-19","2026-02-20","2026-02-23","2026-02-24","2026-02-25","2026-02-26","2026-02-27","2026-03-02","2026-03-03","2026-03-04","2026-03-05","2026-03-06","2026-03-09","2026-03-10","2026-03-11","2026-03-12","2026-03-13","2026-03-16","2026-03-17","2026-03-18","2026-03-19","2026-03-23","2026-03-24","2026-03-25","2026-03-26","2026-03-27","2026-03-30","2026-03-31","2026-04-01","2026-04-02","2026-04-03","2026-04-06","2026-04-07","2026-04-08","2026-04-09","2026-04-10","2026-04-13","2026-04-14","2026-04-15","2026-04-16","2026-04-17","2026-04-20","2026-04-21","2026-04-22","2026-04-24","2026-04-27","2026-04-28","2026-04-29","2026-04-30","2026-05-04","2026-05-05","2026-05-06","2026-05-07","2026-05-08","2026-05-11","2026-05-12","2026-05-13","2026-05-14","2026-05-15","2026-05-18","2026-05-20","2026-05-21","2026-05-22","2026-05-25","2026-05-26","2026-05-27","2026-05-28","2026-05-29","2026-06-01","2026-06-02","2026-06-03","2026-06-04","2026-06-05","2026-06-08","2026-06-09","2026-06-10","2026-06-11","2026-06-12","2026-06-15","2026-06-16","2026-06-17","2026-06-18","2026-06-19","2026-06-22","2026-06-23","2026-06-24","2026-06-25","2026-06-26","2026-06-29","2026-06-30","2026-07-01","2026-07-02","2026-07-03","2026-07-06","2026-07-07","2026-07-08","2026-07-09","2026-07-10","2026-07-13","2026-07-14","2026-07-16","2026-07-17","2026-07-20","2026-07-21","2026-07-22","2026-07-23","2026-07-24","2026-07-27","2026-07-28","2026-07-29","2026-07-30","2026-07-31","2026-08-03","2026-08-04","2026-08-05","2026-08-06","2026-08-07","2026-08-10","2026-08-11","2026-08-12","2026-08-13","2026-08-14","2026-08-17","2026-08-18","2026-08-19","2026-08-20","2026-08-21","2026-08-24","2026-08-25","2026-08-26","2026-08-27","2026-08-28","2026-08-31","2026-09-01","2026-09-02","2026-09-03","2026-09-04","2026-09-07","2026-09-08","2026-09-09","2026-09-10","2026-09-11","2026-09-14","2026-09-15","2026-09-16","2026-09-17","2026-09-18","2026-09-21","2026-09-22","2026-09-23","2026-09-24","2026-09-25","2026-09-28","2026-09-29","2026-09-30","2026-10-01","2026-10-02"],"c":[55.95,58.35,57.35,58.1,57.75,58.65,59.2,59.3,62.45,61.15,59.25,59.25,59.25,58.4,56.2,57.8,61.15,59,58.15,58.75,56.7,56.1,55.35,56,57.05,58.25,59.35,57.6,58.35,61,60.85,60.85,60.2,61.5,60.85,63.85,63.5,65.15,63.55,65.35,65.25,65.8,66,68,68.35,67.7,67.45,67.9,66,68.05,68.5,69,67.55,68.4,70.15,69.45,70.2,70.2,70.3,71,71.2,71.25,71,69.3,69.2,69.2,67.55,68.05,70.75,69.9,69.8,72.05,72.65,74,74.4,73.95,73.2,72.5,73.5,74.85,75.5,77.3,76.6,78.2,78.35,78.8,78.55,78.3,80.25,81.05,82.35,80.65,82,84.05,85.15,85.85,89.65,88.2,88.8,88.7,88.25,88.4,86.2,85.95,85.7,81.55,81.75,78.1,79.65,79.3,80.7,84,83.8,84.1,82.75,83.75,81,86,90,93.45,98.05,101.7,105.4,112.2,108.2,110.3,117,115.9,116.3,117.1,121.7,123.4,112.3,117.5,110.5,120.4,117.5,116,117,119.9,118.3,117.3,117.4,116.7,118.8,117.1,123.1,119.2,119.3,116.6,121.2,128.5,129.9,127.9,131.7,134.5,135.3,138.6,137.4,135,129.8,129.8,137.4,144.2,154.6,149.2,140.4,136.8,138,137.5,138.6,132.3,133,137,136.2,136.3,137.6,135.1,132.2,129.6,129.3,127.6,134.7,139.5,139.2,141.3,144.7,141.5,138.9,144.5,141.5,144.1,146.3,147.1,142.6,148.4,140.3,146.5,150.8,148.4,145.6,149.8,151.2,151.3,152.2,149.7,152.5,154,155.5,161.7,161.9,166.2,176.8,176.5,180.1,182.6,183.2,181.3,179.3,180.3,187,184.4,188.5,185.1,181.6,179,180.5,178.7,172,174.2,170,170.4,171.7,172.4,181.5,180.3,181.5,180.2,185.5,183.3,183.8,183.3,178.5,174.2,178.8,182,175,173.5,173.7,177.4,172.1,173.9,185.2,195.2,194.1,192.2,204.4,213.6,211.2,217.5,218.3,217.3,216.3,215,218.1,217,216.1,215.2,209.5,215.6,219.2,213.5,214,212,207.5,204,194.9,203.9,205.6,207.6,206.5,203.9,208.8,211.4,205.7,203.6,202.6,197.3,194.1,187.4,185.1,186.4,181.4,183.6,177.8,176,188.3,188.2,184.3,184.8,184.7,184.4,180.1,184.1,184.5,183.4,187.2,187.7,185.9,185.1,188.2,193.7,202,205.8,204.9,204,212.2,209.3,201,204.4,211.1,212.8,221.7,224.7,222.7,226.1,221,229,231.7,230.2,240,257,263.5,262.75,280,283,289.75,288,302.5,309.25,316,336.75,303.25,300.25,300.75,323.25,310.5,307.5,319,303.25,299.5,296.75,302.5,285,288,292,298.25,294,301.5,302.25,296.5,294,310.25,307,313.25,310.5,309,306.25,311,322,340,322.25,333,345,333.5,319,334.25,335.75,330,322.25,320.5,341.25,348.75,338.75,353.25,352,337.5,338,330.75,320.5,320.25,320.25,336.5,330.5,337,342,362.25,376.75,398.5,415.25,411.75,416.75,411,414,408,396.5,396.5,392,415,414.5,425.5,420.25,431.75,427.25,434,428,428.5,431.75,419.25,412.75,415.5,415,402,393.5,377.75,410,401.75,380.25,380.25,380.25,380.25,384,407.75,383.5,362.25,363,368,357.25,376.75,377.75,371.25,375.75,394,395,410.75,402.5,394.75,392,367.5,373.5,361.5,357.5,345,371.25,384.75,399.5,401.75,383,377,358.75,370,352.5,348.5,352.5,351.5,354.5,360,370,376.25,380.25,360.5,358,354.5,337.5,342.25,336.25,349.25,346.75,363,353.75,356.25,356.25,381,395.75,387.5,389,381.25,403,402.25,403.25,399.75,403.75,398.25,403.75,404,386.25,384.5,380.75,380.25,388.25,392.5,390,402.25,398.5,393.75,372.5,377,360,379.75,372.75,378,374.5,381.5,367.75,372.25,367.25,338.5,336.5,370,362.75]}
