{"k":"FLR","market":"US","cur":"USD","t":["2024-09-06","2024-09-09","2024-09-10","2024-09-11","2024-09-12","2024-09-13","2024-09-16","2024-09-17","2024-09-18","2024-09-19","2024-09-20","2024-09-23","2024-09-24","2024-09-25","2024-09-26","2024-09-27","2024-09-30","2024-10-01","2024-10-02","2024-10-03","2024-10-04","2024-10-07","2024-10-08","2024-10-09","2024-10-10","2024-10-11","2024-10-14","2024-10-15","2024-10-16","2024-10-17","2024-10-18","2024-10-21","2024-10-22","2024-10-23","2024-10-24","2024-10-25","2024-10-28","2024-10-29","2024-10-30","2024-10-31","2024-11-01","2024-11-04","2024-11-05","2024-11-06","2024-11-07","2024-11-08","2024-11-11","2024-11-12","2024-11-13","2024-11-14","2024-11-15","2024-11-18","2024-11-19","2024-11-20","2024-11-21","2024-11-22","2024-11-25","2024-11-26","2024-11-27","2024-11-29","2024-12-02","2024-12-03","2024-12-04","2024-12-05","2024-12-06","2024-12-09","2024-12-10","2024-12-11","2024-12-12","2024-12-13","2024-12-16","2024-12-17","2024-12-18","2024-12-19","2024-12-20","2024-12-23","2024-12-24","2024-12-26","2024-12-27","2024-12-30","2024-12-31","2025-01-02","2025-01-03","2025-01-06","2025-01-07","2025-01-08","2025-01-10","2025-01-13","2025-01-14","2025-01-15","2025-01-16","2025-01-17","2025-01-21","2025-01-22","2025-01-23","2025-01-24","2025-01-27","2025-01-28","2025-01-29","2025-01-30","2025-01-31","2025-02-03","2025-02-04","2025-02-05","2025-02-06","2025-02-07","2025-02-10","2025-02-11","2025-02-12","2025-02-13","2025-02-14","2025-02-18","2025-02-19","2025-02-20","2025-02-21","2025-02-24","2025-02-25","2025-02-26","2025-02-27","2025-02-28","2025-03-03","2025-03-04","2025-03-05","2025-03-06","2025-03-07","2025-03-10","2025-03-11","2025-03-12","2025-03-13","2025-03-14","2025-03-17","2025-03-18","2025-03-19","2025-03-20","2025-03-21","2025-03-24","2025-03-25","2025-03-26","2025-03-27","2025-03-28","2025-03-31","2025-04-01","2025-04-02","2025-04-03","2025-04-04","2025-04-07","2025-04-08","2025-04-09","2025-04-10","2025-04-11","2025-04-14","2025-04-15","2025-04-16","2025-04-17","2025-04-21","2025-04-22","2025-04-23","2025-04-24","2025-04-25","2025-04-28","2025-04-29","2025-04-30","2025-05-01","2025-05-02","2025-05-05","2025-05-06","2025-05-07","2025-05-08","2025-05-09","2025-05-12","2025-05-13","2025-05-14","2025-05-15","2025-05-16","2025-05-19","2025-05-20","2025-05-21","2025-05-22","2025-05-23","2025-05-27","2025-05-28","2025-05-29","2025-05-30","2025-06-02","2025-06-03","2025-06-04","2025-06-05","2025-06-06","2025-06-09","2025-06-10","2025-06-11","2025-06-12","2025-06-13","2025-06-16","2025-06-17","2025-06-18","2025-06-20","2025-06-23","2025-06-24","2025-06-25","2025-06-26","2025-06-27","2025-06-30","2025-07-01","2025-07-02","2025-07-03","2025-07-07","2025-07-08","2025-07-09","2025-07-10","2025-07-11","2025-07-14","2025-07-15","2025-07-16","2025-07-17","2025-07-18","2025-07-21","2025-07-22","2025-07-23","2025-07-24","2025-07-25","2025-07-28","2025-07-29","2025-07-30","2025-07-31","2025-08-01","2025-08-04","2025-08-05","2025-08-06","2025-08-07","2025-08-08","2025-08-11","2025-08-12","2025-08-13","2025-08-14","2025-08-15","2025-08-18","2025-08-19","2025-08-20","2025-08-21","2025-08-22","2025-08-25","2025-08-26","2025-08-27","2025-08-28","2025-08-29","2025-09-02","2025-09-03","2025-09-04","2025-09-05","2025-09-08","2025-09-09","2025-09-10","2025-09-11","2025-09-12","2025-09-15","2025-09-16","2025-09-17","2025-09-18","2025-09-19","2025-09-22","2025-09-23","2025-09-24","2025-09-25","2025-09-26","2025-09-29","2025-09-30","2025-10-01","2025-10-02","2025-10-03","2025-10-06","2025-10-07","2025-10-08","2025-10-09","2025-10-10","2025-10-13","2025-10-14","2025-10-15","2025-10-16","2025-10-17","2025-10-20","2025-10-21","2025-10-22","2025-10-23","2025-10-24","2025-10-27","2025-10-28","2025-10-29","2025-10-30","2025-10-31","2025-11-03","2025-11-04","2025-11-05","2025-11-06","2025-11-07","2025-11-10","2025-11-11","2025-11-12","2025-11-13","2025-11-14","2025-11-17","2025-11-18","2025-11-19","2025-11-20","2025-11-21","2025-11-24","2025-11-25","2025-11-26","2025-11-28","2025-12-01","2025-12-02","2025-12-03","2025-12-04","2025-12-05","2025-12-08","2025-12-09","2025-12-10","2025-12-11","2025-12-12","2025-12-15","2025-12-16","2025-12-17","2025-12-18","2025-12-19","2025-12-22","2025-12-23","2025-12-24","2025-12-26","2025-12-29","2025-12-30","2025-12-31","2026-01-02","2026-01-05","2026-01-06","2026-01-07","2026-01-08","2026-01-09","2026-01-12","2026-01-13","2026-01-14","2026-01-15","2026-01-16","2026-01-20","2026-01-21","2026-01-22","2026-01-23","2026-01-26","2026-01-27","2026-01-28","2026-01-29","2026-01-30","2026-02-02","2026-02-03","2026-02-04","2026-02-05","2026-02-06","2026-02-09","2026-02-10","2026-02-11","2026-02-12","2026-02-13","2026-02-17","2026-02-18","2026-02-19","2026-02-20","2026-02-23","2026-02-24","2026-02-25","2026-02-26","2026-02-27","2026-03-02","2026-03-03","2026-03-04","2026-03-05","2026-03-06","2026-03-09","2026-03-10","2026-03-11","2026-03-12","2026-03-13","2026-03-16","2026-03-17","2026-03-18","2026-03-19","2026-03-20","2026-03-23","2026-03-24","2026-03-25","2026-03-26","2026-03-27","2026-03-30","2026-03-31","2026-04-01","2026-04-02","2026-04-06","2026-04-07","2026-04-08","2026-04-09","2026-04-10","2026-04-13","2026-04-14","2026-04-15","2026-04-16","2026-04-17","2026-04-20","2026-04-21","2026-04-22","2026-04-23","2026-04-24","2026-04-27","2026-04-28","2026-04-29","2026-04-30","2026-05-01","2026-05-04","2026-05-05","2026-05-06","2026-05-07","2026-05-08","2026-05-11","2026-05-12","2026-05-13","2026-05-14","2026-05-15","2026-05-18","2026-05-19","2026-05-20","2026-05-21","2026-05-22","2026-05-26","2026-05-27","2026-05-28","2026-05-29","2026-06-01","2026-06-02","2026-06-03","2026-06-04","2026-06-05","2026-06-08","2026-06-09","2026-06-10","2026-06-11","2026-06-12","2026-06-15","2026-06-16","2026-06-17","2026-06-18","2026-06-22","2026-06-23","2026-06-24","2026-06-25","2026-06-26","2026-06-29","2026-06-30","2026-07-01","2026-07-02","2026-07-06","2026-07-07","2026-07-08","2026-07-09","2026-07-10","2026-07-13","2026-07-14","2026-07-15","2026-07-16","2026-07-17","2026-07-20","2026-07-21","2026-07-22","2026-07-23","2026-07-24","2026-07-27","2026-07-28","2026-07-29","2026-07-30","2026-07-31","2026-08-03","2026-08-04","2026-08-05","2026-08-06","2026-08-07","2026-08-10","2026-08-11","2026-08-12","2026-08-13","2026-08-14","2026-08-17","2026-08-18","2026-08-19","2026-08-20","2026-08-21","2026-08-24","2026-08-25","2026-08-26","2026-08-27","2026-08-28","2026-08-31","2026-09-01","2026-09-02","2026-09-03","2026-09-04","2026-09-08","2026-09-09","2026-09-10","2026-09-11","2026-09-14","2026-09-15","2026-09-16","2026-09-17","2026-09-18","2026-09-21","2026-09-22","2026-09-23","2026-09-24","2026-09-25","2026-09-28","2026-09-29","2026-09-30","2026-10-01","2026-10-02"],"c":[44.04,44.15,43.95,44.43,44.9,45.89,46.18,46.21,45.91,47.45,47.19,46.65,46.28,45.71,47.34,47.89,47.71,46.92,47.62,49.05,49.97,50.64,50.43,50.41,49.98,51.06,51.61,50.47,54.61,53.88,55,53.86,53.67,52.83,52.38,52.28,53.63,53.2,53.1,52.28,52.89,52.81,54.59,58.74,58.93,50.93,49.82,48.5,50.33,50.8,51.92,52.95,52.67,52.53,54.72,55.79,56.04,55.93,55.25,56.13,55.11,54.7,56.05,55.97,55.79,55.26,55.19,55.83,55.42,54.64,54.63,53.45,50.11,50.08,50.34,50.22,50.69,50.67,50.06,49.34,49.32,49.27,51,51.68,50.54,49.32,48.23,48.11,48.73,49.28,49.51,50.39,53.52,54.26,55.28,54.57,46.34,46.54,48.1,48.54,48.21,47.14,47.64,47.77,48.8,49.34,50.14,47.86,46.36,44.93,43.4,39.75,39.53,39.83,37.73,37.16,36.81,37.71,37.34,38.03,36.92,35.93,37.06,36.58,36.14,34.29,35.6,35.57,34.94,36.81,37.35,37.2,38.24,37.67,37.66,38.92,38.74,37.74,37.16,36.19,35.82,36.35,37.22,33.97,31.02,31.55,30.86,34.73,33.07,33.28,33.61,33.99,33.55,33.96,33.01,33.88,34.44,35.6,35.56,35.02,35.07,34.89,35.78,35.77,34.42,35.11,34.81,35.61,35.86,37.53,38.77,38.72,38.53,38.48,37.9,38.35,37.88,37.58,41.04,43.54,42.44,42.16,41.58,41.15,43.39,42.89,42.95,44.43,45.14,44.87,49.79,48.39,48.28,50.84,49.88,50.04,49.64,49.11,51.24,49.75,51.38,51.42,51.27,50.31,51.48,52.76,52.19,51.23,51.64,52.04,52.27,53.81,52.95,53.52,53.93,54.95,54.03,54.04,55.64,55.62,56.61,56.23,55.99,56.03,56.77,41.42,39.99,41.25,43.91,44.13,41.89,41.67,43.46,42.65,41.55,41.88,42.12,41.27,40.88,41.04,41.55,41.25,41.41,41.1,41.61,41.02,41.74,42.87,41.47,41.57,40.81,40.71,41.36,41.31,41.01,41.48,40.79,40.34,42.42,44.6,44.75,44.03,43.75,42.4,42.17,42.64,42.07,42.86,43.47,43.13,43.93,42.92,44.04,43.51,43.98,47.22,48.23,50.73,48.46,46.65,47.88,48.79,46.45,47.67,48.95,48.5,50.01,49.31,48.79,48.77,48.05,46.22,47.41,44.58,45.72,45.59,45.35,45.73,43.04,42.39,41.12,41.13,41.62,40.55,40.05,41.22,41.84,42.41,42.93,42.4,42.65,44.05,45.45,43.96,43.35,43.4,43.39,44.87,43.6,43.34,42.86,40.86,41.3,40.91,40.79,40.9,40.94,40.82,40.4,40.3,39.63,41.7,44.62,44.86,44.4,43.44,44.29,44.54,44.31,44.3,43.44,43.97,42.97,44.8,45.61,45.58,45.69,45.99,46.78,46.96,46.19,46.88,46.4,45.66,44.97,46.92,48.25,48.13,47.34,45.67,45.48,48.57,50.64,52.84,53.69,51.63,53.1,53.55,52.09,52.31,50.91,48.8,48.15,46.18,45.08,45.82,44.96,44.6,43.48,43.02,43.83,44.66,45.64,47.87,44.92,46.96,47.47,47.94,46.38,45.74,43.78,46.65,47.55,47.14,46.98,47.72,49.15,49.07,49.21,49.56,49.27,48.56,47.88,48.56,48.1,47.14,47.87,47.62,48.23,51.68,50.53,51.76,53.35,53,52.49,52.99,54.2,51.08,43.31,43.69,44.73,45.03,45.49,44.36,44.35,42.53,43.43,44.59,44.87,46.86,47.3,46.97,45.76,46.55,49.34,50.16,50.41,47.56,49.52,49.48,46.84,50.15,50.76,50.47,50.65,51.92,53.66,54.42,53.37,53.17,53.62,53.64,53.73,52.39,50.35,49.45,51.46,48.61,49.51,50.21,50.74,49.63,51.12,50.77,49.51,49.08,49.49,51.39,51.59,53.26,52.19,51.7,49.34,46.83,50.07,50.17,50.17,51.54,50.42,48.75,57,52.25,52.95,52.03,52.33,52.37,54.74,53.42,54.06,52.16,52.42,51.28,51.26,52.03,54.1,53.27,54.51,56.25,56.6,57.5,56.16,56.62,54.83,53.55,54.2,53.51,54.04,52.99,54.96,54.9,54.74,54.03,53.06,50.63,50.38,49.22,49.83,47.88,49.33,49.9]}
